{
  "release": "v0.14.0",
  "reviewed_at": "2026-08-20T00:00:00Z",
  "upstreams": [
    {
      "repo": "trust-systems-meta-model",
      "url": "local archive: trust-systems-meta-model-main.zip",
      "tracked_ref": "main",
      "role": "Semantic governance model and runtime governance envelope source",
      "local_archive_reviewed": "trust-systems-meta-model-main.zip"
    },
    {
      "repo": "OpenVTC/dtg-credentials",
      "url": "https://github.com/OpenVTC/dtg-credentials",
      "tracked_ref": "main",
      "role": "DTG credential creation and verification implementation",
      "local_archive_reviewed": "dtg-credentials-main.zip"
    },
    {
      "repo": "OpenVTC/openvtc",
      "url": "https://github.com/OpenVTC/openvtc",
      "tracked_ref": "main",
      "role": "OpenVTC relationship, VRC, DID, and runtime workflow implementation",
      "local_archive_reviewed": "openvtc-main.zip"
    },
    {
      "repo": "OpenVTC/verifiable-trust-infrastructure",
      "url": "https://github.com/OpenVTC/verifiable-trust-infrastructure",
      "tracked_ref": "main",
      "role": "VTI/VTA authority, sealed transfer, DID template, attestation, and integration implementation",
      "local_archive_reviewed": "verifiable-trust-infrastructure-main.zip"
    },
    {
      "repo": "trustoverip/dtgwg-cred-spec",
      "url": "https://github.com/trustoverip/dtgwg-cred-spec",
      "tracked_ref": "b89f389abbdae77ba60b673c0836c781c2b54169",
      "role": "Normative DTG credential specification; VWC edge-binding authority"
    },
    {
      "repo": "trustoverip/dtgwg-trust-tasks-tf",
      "url": "https://github.com/trustoverip/dtgwg-trust-tasks-tf",
      "tracked_ref": "a8cc6f3373525716a19747b834460a225ff08516",
      "role": "Trust Task protocol and implementation family"
    },
    {
      "repo": "trustoverip/dtgwg-zkp-tf",
      "url": "https://github.com/trustoverip/dtgwg-zkp-tf",
      "tracked_ref": "b37d52fca4ab64ef759d4952b13757f3b23cb20b",
      "role": "Privacy and zero-knowledge requirements; no merged schema delta at reviewed ref"
    }
  ],
  "mappings": [
    {
      "repo": "trustoverip/dtgwg-cred-spec",
      "artifact": "Verifiable Witness Credential (VWC)",
      "role": "Normative credential semantic input",
      "authority_surface": "Witness issuer, observed party, trust-task context, and required digest binding to the exact JCS-canonicalized VRC.",
      "evidence_produced": [
        "WitnessCredential",
        "VRC digest edge binding",
        "trust-task context binding"
      ],
      "tis_profile": [
        "credentials/dtg/v1/witness-credential.json"
      ],
      "assurance_implication": "A VWC is not treated as evidence of a specific edge unless the referenced VRC is available and its digest can be recomputed and matched.",
      "validation_status": "validated-example"
    },
    {
      "repo": "OpenVTC/dtg-credentials",
      "artifact": "DTG VC envelope",
      "role": "Credential wire compatibility",
      "authority_surface": "Issuer DID, VC type array, validity window, proof suite, and credentialSubject binding",
      "evidence_produced": [
        "VerifiableCredential",
        "DataIntegrityProof"
      ],
      "tis_profile": [
        "credentials/dtg/v1/dtg-vc-envelope.json",
        "credentials/dtg/v1/dtg-credential-subject.json"
      ],
      "assurance_implication": "Establishes minimum interoperable shape before applying stronger TIS semantic overlays.",
      "validation_status": "validated-example"
    },
    {
      "repo": "OpenVTC/openvtc",
      "artifact": "Relationship and VRC workflow state",
      "role": "Runtime evidence capture",
      "authority_surface": "Persona DID, relationship counterparty, mediator, VRC issuer, and storage state",
      "evidence_produced": [
        "relationship-state",
        "vrc-issuance-receipt",
        "config-evidence",
        "didcomm-routing-evidence"
      ],
      "tis_profile": [
        "profiles/openvtc/openvtc-relationship-state.schema.json",
        "profiles/openvtc/openvtc-vrc-issuance-receipt.schema.json"
      ],
      "assurance_implication": "Makes OpenVTC workflow state replayable as evidence for decision receipts and relying-party evaluation.",
      "validation_status": "validated-example"
    },
    {
      "repo": "OpenVTC/verifiable-trust-infrastructure",
      "artifact": "VTA authorization and provision integration",
      "role": "Executable authority and enforcement profile",
      "authority_surface": "VTA context, ACL entry, authorization credential, sealed transfer, DID template, and attestation reference",
      "evidence_produced": [
        "vta-context",
        "acl-entry",
        "sealed-transfer-envelope",
        "tee-attestation-reference",
        "provision-integration-receipt"
      ],
      "tis_profile": [
        "profiles/vti/vta-context.schema.json",
        "profiles/vti/provision-integration-receipt.schema.json"
      ],
      "assurance_implication": "Captures authority, delegation, scope, enforcement, revocation, and audit evidence for runtime trust operations.",
      "validation_status": "validated-example"
    },
    {
      "repo": "trust-systems-meta-model",
      "artifact": "Runtime governance envelope",
      "role": "Semantic source for runtime assurance projection",
      "authority_surface": "Actor, requested effect, trust boundary, authority basis, delegation chain, policy, evidence, revocation check, decision, and audit expectation.",
      "evidence_produced": [
        "runtime-governance-projection",
        "decision-receipt",
        "audit-reference"
      ],
      "tis_profile": [
        "profiles/tsmm/tsmm-runtime-governance-projection.schema.json",
        "docs/crosswalks/tsmm-runtime-governance-crosswalk.md"
      ],
      "assurance_implication": "Establishes TSMM as the semantic governance layer and TIS as the executable artifact contract layer.",
      "validation_status": "validated-example"
    },
    {
      "repo": "OpenVTC/verifiable-trust-infrastructure",
      "artifact": "VTA ACL capability and status enforcement",
      "role": "Authority and revocation evidence capture",
      "authority_surface": "VTI roles, capability grants, context scope, consumer kind, lifecycle state, step-up, and status-list checks.",
      "evidence_produced": [
        "vta-acl-entry",
        "vta-authorization-credential",
        "status-list-reference"
      ],
      "tis_profile": [
        "profiles/vti/vta-acl-entry.schema.json",
        "profiles/vti/vta-authorization-credential.schema.json",
        "profiles/vti/status-list-reference.schema.json"
      ],
      "assurance_implication": "Makes authorization evidence effect-bound, status-aware, and auditable.",
      "validation_status": "validated-example"
    },
    {
      "repo": "OpenVTC/openvtc",
      "artifact": "Relationship state and task evidence normalization",
      "role": "Relationship and workflow runtime evidence capture",
      "authority_surface": "Persona DID, relationship ID, implementation state, normalized relationship state, lifecycle state, and evidence references.",
      "evidence_produced": [
        "openvtc-state-normalization",
        "openvtc-task-evidence"
      ],
      "tis_profile": [
        "profiles/openvtc/openvtc-state-normalization.schema.json",
        "profiles/openvtc/openvtc-task-evidence.schema.json"
      ],
      "assurance_implication": "Prevents implementation workflow state from being misread as governance outcome and enables task evidence replay.",
      "validation_status": "validated-example"
    }
  ],
  "drift_review": {
    "cadence": "Review upstream release notes and schema-relevant implementation changes before each TIS minor release and at least monthly while profiles remain experimental.",
    "signals": [
      "credential type or context changes",
      "new DID method support",
      "relationship/VRC state machine changes",
      "VTA ACL or context model changes",
      "sealed transfer envelope changes",
      "attestation or DID template changes",
      "breaking changes in CLI output or examples",
      "TSMM runtime governance envelope changes",
      "Trust Task lifecycle vocabulary changes",
      "VTI capability or ACL role vocabulary changes",
      "status-list or revocation semantics changes"
    ],
    "required_action": "Open a TIS drift review issue when upstream changes alter artifact shape, authority semantics, evidence requirements, or validation fixtures."
  }
}
